{
  "schema_version": "2",
  "id": "cn-ancient.railing.balustrade-corner-a",
  "name": "望柱（转角逐）",
  "version": "1.0.0",
  "status": "published",
  "flags": [
    "needs-material-review"
  ],
  "kit": "cn-ancient",
  "category": "components/railing",
  "tier": "primitive",
  "granularity": "L2",
  "tags": [
    "railing",
    "post",
    "stone",
    "程序化"
  ],
  "geometry": {
    "dimensions_m": [
      0.5,
      1,
      0.5
    ],
    "pivot": "bottom-center",
    "axis": {
      "up": "+Y",
      "forward": "-Z"
    },
    "polycount": 36,
    "vertices": 108
  },
  "files": {
    "model": {
      "lod0": "lod0.glb"
    },
    "preview": [
      "preview.png"
    ],
    "collision": null
  },
  "shell": {
    "has_uv": false,
    "manifold": true,
    "solidified": true
  },
  "materials": {
    "slots": [
      {
        "slot": "railing",
        "ref": "stone/bai-shi"
      },
      {
        "slot": "trim",
        "ref": "stone/qing-shi"
      }
    ],
    "embedded_textures": 0
  },
  "collision": "box",
  "sockets": [
    {
      "name": "bottom",
      "type": "ground-foot",
      "direction": "-y",
      "position_m": [
        0,
        0,
        0
      ],
      "mate_types": [
        "stack-up",
        "roof-seat"
      ],
      "grid_locked": true,
      "note": "承重基准点（轴心）"
    },
    {
      "name": "end-west",
      "type": "wall-line",
      "direction": "-x",
      "position_m": [
        0,
        0,
        0
      ],
      "mate_types": [
        "wall-line"
      ],
      "grid_locked": true,
      "note": "落轴心：栏板直段以本柱轴线为续接基准"
    },
    {
      "name": "end-east",
      "type": "wall-line",
      "direction": "+x",
      "position_m": [
        0,
        0,
        0
      ],
      "mate_types": [
        "wall-line"
      ],
      "grid_locked": true,
      "note": "落轴心"
    },
    {
      "name": "end-south",
      "type": "wall-line",
      "direction": "-z",
      "position_m": [
        0,
        0,
        0
      ],
      "mate_types": [
        "wall-line"
      ],
      "grid_locked": true,
      "note": "落轴心"
    },
    {
      "name": "end-north",
      "type": "wall-line",
      "direction": "+z",
      "position_m": [
        0,
        0,
        0
      ],
      "mate_types": [
        "wall-line"
      ],
      "grid_locked": true,
      "note": "落轴心"
    }
  ],
  "license": "CC0-1.0",
  "author": "GBE-Studio · 程序化生成器（参数化，非 AI 生成）"
}
