{
  "schema_version": "2",
  "id": "cn-ancient.beam.efang-group-a",
  "name": "额枋组（额枋 + 平板枋）",
  "version": "1.0.0",
  "status": "published",
  "flags": [
    "needs-material-review"
  ],
  "kit": "cn-ancient",
  "category": "components/beam",
  "tier": "primitive",
  "granularity": "L2",
  "tags": [
    "beam",
    "efang",
    "timber",
    "程序化"
  ],
  "geometry": {
    "dimensions_m": [
      4,
      0.5,
      0.5
    ],
    "pivot": "bottom-center",
    "axis": {
      "up": "+Y",
      "forward": "-Z"
    },
    "polycount": 24,
    "vertices": 72
  },
  "files": {
    "model": {
      "lod0": "lod0.glb"
    },
    "preview": [
      "preview.png"
    ],
    "collision": null
  },
  "shell": {
    "has_uv": false,
    "manifold": true,
    "solidified": true
  },
  "materials": {
    "slots": [
      {
        "slot": "beam",
        "ref": "timber/zhu-hong"
      },
      {
        "slot": "trim",
        "ref": "timber/hei-qi"
      }
    ],
    "embedded_textures": 0
  },
  "collision": "box",
  "sockets": [
    {
      "name": "end-west",
      "type": "wall-line",
      "direction": "-x",
      "position_m": [
        -2,
        0,
        0
      ],
      "mate_types": [
        "wall-line"
      ],
      "grid_locked": true
    },
    {
      "name": "end-east",
      "type": "wall-line",
      "direction": "+x",
      "position_m": [
        2,
        0,
        0
      ],
      "mate_types": [
        "wall-line"
      ],
      "grid_locked": true
    },
    {
      "name": "bottom",
      "type": "ground-foot",
      "direction": "-y",
      "position_m": [
        0,
        0,
        0
      ],
      "mate_types": [
        "stack-up",
        "roof-seat"
      ],
      "grid_locked": true,
      "note": "两端搭柱头，但底面中心亦须可承接"
    },
    {
      "name": "top",
      "type": "stack-up",
      "direction": "+y",
      "position_m": [
        0,
        0.5,
        0
      ],
      "mate_types": [
        "ground-foot"
      ],
      "grid_locked": true,
      "note": "平板枋顶承斗拱"
    },
    {
      "name": "run-east",
      "type": "continue",
      "direction": "+x",
      "position_m": [
        2,
        0,
        0
      ],
      "step_m": 4,
      "mate_types": [
        "continue"
      ],
      "grid_locked": true,
      "note": "沿柱网重复，步距 = pillar_spacing_m 4 m"
    }
  ],
  "license": "CC0-1.0",
  "author": "GBE-Studio · 程序化生成器（参数化，非 AI 生成）"
}
