{
  "schema_version": "2",
  "id": "cn-ancient.roof.yingshan-single-a",
  "name": "硬山单檐（整体 · 灰模）",
  "version": "1.0.0",
  "status": "published",
  "flags": [
    "needs-material-review"
  ],
  "kit": "cn-ancient",
  "category": "components/roof",
  "tier": "mass",
  "granularity": "L1",
  "tags": [
    "roof",
    "yingshan",
    "hard-mtn",
    "程序化",
    "灰模"
  ],
  "geometry": {
    "dimensions_m": [
      10,
      2,
      7
    ],
    "pivot": "bottom-center",
    "axis": {
      "up": "+Y",
      "forward": "-Z"
    },
    "polycount": 16,
    "vertices": 48
  },
  "files": {
    "model": {
      "lod0": "lod0.glb"
    },
    "preview": [
      "preview.png"
    ],
    "collision": null
  },
  "shell": {
    "has_uv": false,
    "manifold": true,
    "solidified": true
  },
  "materials": {
    "slots": [
      {
        "slot": "roof",
        "ref": "roof-tile/qingwa"
      }
    ],
    "embedded_textures": 0
  },
  "collision": "box",
  "sockets": [
    {
      "name": "bottom",
      "type": "ground-foot",
      "direction": "-y",
      "position_m": [
        0,
        0,
        0
      ],
      "mate_types": [
        "stack-up",
        "roof-seat"
      ],
      "grid_locked": true,
      "note": "坐在檐檩 / 墙顶；硬山两山与山墙齐平，X 向不悬挑"
    },
    {
      "name": "ridge-west",
      "type": "ridge-point",
      "direction": "-x",
      "position_m": [
        -5,
        2,
        0
      ],
      "mate_types": [
        "ridge-point"
      ],
      "grid_locked": true,
      "note": "正脊西端（与山墙齐平）"
    },
    {
      "name": "ridge-east",
      "type": "ridge-point",
      "direction": "+x",
      "position_m": [
        5,
        2,
        0
      ],
      "mate_types": [
        "ridge-point"
      ],
      "grid_locked": true,
      "note": "正脊东端（与山墙齐平）"
    },
    {
      "name": "ridge-seat",
      "type": "roof-seat",
      "direction": "+y",
      "position_m": [
        0,
        2,
        0
      ],
      "mate_types": [
        "ground-foot",
        "stack-up"
      ],
      "grid_locked": true,
      "note": "正脊落此面（ridge-main-a 的 bottom 接这里）"
    }
  ],
  "license": "CC0-1.0",
  "author": "GBE-Studio · 程序化生成器（参数化，非 AI 生成）"
}
