{
  "schema_version": "2",
  "id": "cn-ancient.ornament.ding-door",
  "name": "门钉",
  "version": "1.0.0",
  "status": "published",
  "flags": [
    "needs-material-review"
  ],
  "kit": "cn-ancient",
  "category": "components/ornament",
  "tier": "primitive",
  "granularity": "L3",
  "tags": [
    "ornament",
    "nail",
    "metal",
    "程序化"
  ],
  "geometry": {
    "dimensions_m": [
      0.25,
      0.1,
      0.25
    ],
    "pivot": "bottom-center",
    "axis": {
      "up": "+Y",
      "forward": "-Z"
    },
    "polycount": 144,
    "vertices": 432
  },
  "files": {
    "model": {
      "lod0": "lod0.glb"
    },
    "preview": [
      "preview.png"
    ],
    "collision": null
  },
  "shell": {
    "has_uv": false,
    "manifold": true,
    "solidified": true
  },
  "materials": {
    "slots": [
      {
        "slot": "ornament",
        "ref": "metal/tong-liu-jin"
      }
    ],
    "embedded_textures": 0
  },
  "collision": "none",
  "sockets": [
    {
      "name": "mount",
      "type": "attach",
      "direction": "-y",
      "position_m": [
        0,
        0,
        0
      ],
      "mate_types": [
        "attach",
        "wall-line",
        "stack-up",
        "roof-seat",
        "ridge-point",
        "continue"
      ],
      "note": "贴在门板上，允许非网格落点"
    }
  ],
  "license": "CC0-1.0",
  "author": "GBE-Studio · 程序化生成器（参数化，非 AI 生成）"
}
