{
  "schema_version": "2",
  "id": "cn-ancient.roof.purlin-round-a",
  "name": "檩条（圆檩）",
  "version": "1.0.0",
  "status": "published",
  "flags": [
    "needs-material-review"
  ],
  "kit": "cn-ancient",
  "category": "components/roof",
  "tier": "primitive",
  "granularity": "L2",
  "tags": [
    "roof",
    "purlin",
    "timber",
    "程序化"
  ],
  "geometry": {
    "dimensions_m": [
      2,
      0.25,
      0.25
    ],
    "pivot": "bottom-center",
    "axis": {
      "up": "+Y",
      "forward": "-Z"
    },
    "polycount": 48,
    "vertices": 144
  },
  "files": {
    "model": {
      "lod0": "lod0.glb"
    },
    "preview": [
      "preview.png"
    ],
    "collision": null
  },
  "shell": {
    "has_uv": false,
    "manifold": true,
    "solidified": true
  },
  "materials": {
    "slots": [
      {
        "slot": "beam",
        "ref": "timber/ben-se"
      }
    ],
    "embedded_textures": 0
  },
  "collision": "box",
  "sockets": [
    {
      "name": "run-east",
      "type": "continue",
      "direction": "+x",
      "position_m": [
        0,
        0,
        0
      ],
      "step_m": 2,
      "mate_types": [
        "continue"
      ],
      "grid_locked": true,
      "note": "沿面阔重复，步距 = 柱距"
    },
    {
      "name": "end-west",
      "type": "wall-line",
      "direction": "-x",
      "position_m": [
        -1,
        0,
        0
      ],
      "mate_types": [
        "wall-line"
      ],
      "grid_locked": true
    },
    {
      "name": "end-east",
      "type": "wall-line",
      "direction": "+x",
      "position_m": [
        1,
        0,
        0
      ],
      "mate_types": [
        "wall-line"
      ],
      "grid_locked": true
    },
    {
      "name": "seat",
      "type": "roof-seat",
      "direction": "+y",
      "position_m": [
        0,
        0,
        0
      ],
      "mate_types": [
        "ground-foot",
        "stack-up"
      ],
      "grid_locked": true,
      "note": "椽 / 望板落此面。坐标取**轴心**（0,0,0）而非顶面切点 0.25 —— 圆檩的定位基准本就是轴心线，且 0.25 落不到 0.5 定位网格"
    }
  ],
  "license": "CC0-1.0",
  "author": "GBE-Studio · 程序化生成器（参数化，非 AI 生成）"
}
