{
  "schema_version": "2",
  "id": "cn-ancient.base.curb-stone-straight",
  "name": "阶条石（直段）",
  "version": "1.0.0",
  "status": "published",
  "flags": [
    "needs-material-review"
  ],
  "kit": "cn-ancient",
  "category": "components/base",
  "tier": "primitive",
  "granularity": "L2",
  "tags": [
    "base",
    "curb",
    "stone",
    "程序化"
  ],
  "geometry": {
    "dimensions_m": [
      2,
      0.5,
      0.5
    ],
    "pivot": "bottom-center",
    "axis": {
      "up": "+Y",
      "forward": "-Z"
    },
    "polycount": 24,
    "vertices": 72
  },
  "files": {
    "model": {
      "lod0": "lod0.glb"
    },
    "preview": [
      "preview.png"
    ],
    "collision": null
  },
  "shell": {
    "has_uv": false,
    "manifold": true,
    "solidified": true
  },
  "materials": {
    "slots": [
      {
        "slot": "base",
        "ref": "stone/qing-shi"
      }
    ],
    "embedded_textures": 0
  },
  "collision": "box",
  "sockets": [
    {
      "name": "bottom",
      "type": "ground-foot",
      "direction": "-y",
      "position_m": [
        0,
        0,
        0
      ],
      "mate_types": [
        "stack-up",
        "roof-seat"
      ],
      "grid_locked": true,
      "note": "承重基准点（轴心）"
    },
    {
      "name": "top",
      "type": "stack-up",
      "direction": "+y",
      "position_m": [
        0,
        0.5,
        0
      ],
      "mate_types": [
        "ground-foot"
      ],
      "grid_locked": true,
      "note": "上承墙身 / 栏板"
    },
    {
      "name": "end-west",
      "type": "wall-line",
      "direction": "-x",
      "position_m": [
        -1,
        0,
        0
      ],
      "mate_types": [
        "wall-line"
      ],
      "grid_locked": true
    },
    {
      "name": "end-east",
      "type": "wall-line",
      "direction": "+x",
      "position_m": [
        1,
        0,
        0
      ],
      "mate_types": [
        "wall-line"
      ],
      "grid_locked": true
    },
    {
      "name": "run-east",
      "type": "continue",
      "direction": "+x",
      "position_m": [
        1,
        0,
        0
      ],
      "step_m": 2,
      "mate_types": [
        "continue"
      ],
      "grid_locked": true,
      "note": "沿墙线重复，步距 = wall_module_m"
    }
  ],
  "license": "CC0-1.0",
  "author": "GBE-Studio · 程序化生成器（参数化，非 AI 生成）"
}
