{
  "schema_version": "2",
  "id": "cn-ancient.ground-tile.road-a",
  "name": "地面·土路（2 m 块）",
  "version": "1.0.0",
  "status": "published",
  "flags": [
    "needs-material-review"
  ],
  "kit": "cn-ancient",
  "category": "terrain/ground-tile",
  "tier": "primitive",
  "granularity": "L1",
  "tags": [
    "terrain",
    "ground",
    "road",
    "程序化"
  ],
  "geometry": {
    "dimensions_m": [
      2,
      0.1,
      2
    ],
    "pivot": "bottom-center",
    "axis": {
      "up": "+Y",
      "forward": "-Z"
    },
    "polycount": 12,
    "vertices": 36
  },
  "files": {
    "model": {
      "lod0": "lod0.glb"
    },
    "preview": [
      "preview.png"
    ],
    "collision": null
  },
  "shell": {
    "has_uv": false,
    "manifold": true,
    "solidified": true
  },
  "materials": {
    "slots": [
      {
        "slot": "ground",
        "ref": "earth/qing-zhuan"
      }
    ],
    "embedded_textures": 0
  },
  "collision": "box",
  "sockets": [
    {
      "name": "bottom",
      "type": "ground-foot",
      "direction": "-y",
      "position_m": [
        0,
        0,
        0
      ],
      "mate_types": [
        "stack-up",
        "roof-seat"
      ],
      "grid_locked": true,
      "note": "地面基准"
    },
    {
      "name": "run-east",
      "type": "continue",
      "direction": "+x",
      "position_m": [
        1,
        0,
        0
      ],
      "step_m": 2,
      "mate_types": [
        "continue"
      ],
      "grid_locked": true,
      "note": "沿 X 铺块"
    },
    {
      "name": "run-south",
      "type": "continue",
      "direction": "+z",
      "position_m": [
        0,
        0,
        1
      ],
      "step_m": 2,
      "mate_types": [
        "continue"
      ],
      "grid_locked": true,
      "note": "沿 Z 铺块"
    }
  ],
  "license": "CC0-1.0",
  "author": "GBE-Studio · 程序化生成器（参数化，非 AI 生成）"
}
