{
  "schema_version": "2",
  "id": "cn-ancient.wall.shanqiang-a",
  "name": "山墙（硬山 · 7 m 段）",
  "version": "1.0.0",
  "status": "published",
  "flags": [
    "needs-material-review"
  ],
  "kit": "cn-ancient",
  "category": "components/wall",
  "tier": "component",
  "granularity": "L2",
  "tags": [
    "wall",
    "shanqiang",
    "gable",
    "程序化"
  ],
  "geometry": {
    "dimensions_m": [
      7,
      3,
      0.5
    ],
    "pivot": "bottom-center",
    "axis": {
      "up": "+Y",
      "forward": "-Z"
    },
    "polycount": 36,
    "vertices": 108
  },
  "files": {
    "model": {
      "lod0": "lod0.glb"
    },
    "preview": [
      "preview.png"
    ],
    "collision": null
  },
  "shell": {
    "has_uv": false,
    "manifold": true,
    "solidified": true
  },
  "materials": {
    "slots": [
      {
        "slot": "wall",
        "ref": "earth/hang-tu"
      },
      {
        "slot": "trim",
        "ref": "stone/qing-shi"
      }
    ],
    "embedded_textures": 0
  },
  "collision": "box",
  "sockets": [
    {
      "name": "bottom",
      "type": "ground-foot",
      "direction": "-y",
      "position_m": [
        0,
        0,
        0
      ],
      "mate_types": [
        "stack-up",
        "roof-seat"
      ],
      "grid_locked": true,
      "note": "承重基准点（轴心）"
    },
    {
      "name": "top",
      "type": "stack-up",
      "direction": "+y",
      "position_m": [
        0,
        3,
        0
      ],
      "mate_types": [
        "ground-foot"
      ],
      "grid_locked": true,
      "note": "墙顶承屋面"
    },
    {
      "name": "roof-seat",
      "type": "roof-seat",
      "direction": "+y",
      "position_m": [
        0,
        3,
        0
      ],
      "mate_types": [
        "ground-foot",
        "stack-up"
      ],
      "grid_locked": true,
      "note": "硬山整体屋面的 bottom 落此面"
    },
    {
      "name": "end-west",
      "type": "wall-line",
      "direction": "-x",
      "position_m": [
        -3.5,
        0,
        0
      ],
      "mate_types": [
        "wall-line"
      ],
      "grid_locked": true,
      "note": "与前后墙 / 转角件续接"
    },
    {
      "name": "end-east",
      "type": "wall-line",
      "direction": "+x",
      "position_m": [
        3.5,
        0,
        0
      ],
      "mate_types": [
        "wall-line"
      ],
      "grid_locked": true,
      "note": "与前后墙 / 转角件续接"
    },
    {
      "name": "run-east",
      "type": "continue",
      "direction": "+x",
      "position_m": [
        3.5,
        0,
        0
      ],
      "step_m": 3.5,
      "mate_types": [
        "continue"
      ],
      "grid_locked": true,
      "note": "同轴续接时按 3.5 m 步距（半跨）"
    }
  ],
  "license": "CC0-1.0",
  "author": "GBE-Studio · 程序化生成器（参数化，非 AI 生成）"
}
