{
  "schema_version": "2",
  "id": "cn-ancient.door-window.window-fan-lattice-a",
  "name": "扇形格扇窗",
  "version": "1.0.0",
  "status": "published",
  "flags": [
    "needs-material-review"
  ],
  "kit": "cn-ancient",
  "category": "components/door-window",
  "tier": "mass",
  "granularity": "L2",
  "tags": [
    "window",
    "lattice",
    "fan",
    "程序化"
  ],
  "geometry": {
    "dimensions_m": [
      2,
      1.5,
      0.25
    ],
    "pivot": "bottom-center",
    "axis": {
      "up": "+Y",
      "forward": "-Z"
    },
    "polycount": 204,
    "vertices": 612
  },
  "files": {
    "model": {
      "lod0": "lod0.glb"
    },
    "preview": [
      "preview.png"
    ],
    "collision": null
  },
  "shell": {
    "has_uv": false,
    "manifold": true,
    "solidified": true
  },
  "materials": {
    "slots": [
      {
        "slot": "window",
        "ref": "timber/ben-se"
      },
      {
        "slot": "trim",
        "ref": "timber/hei-qi"
      }
    ],
    "embedded_textures": 0
  },
  "collision": "box",
  "sockets": [
    {
      "name": "bottom",
      "type": "ground-foot",
      "direction": "-y",
      "position_m": [
        0,
        0,
        0
      ],
      "mate_types": [
        "stack-up",
        "roof-seat"
      ],
      "grid_locked": true,
      "note": "落地定位；装配时通常由墙洞承接"
    },
    {
      "name": "end-west",
      "type": "wall-line",
      "direction": "-x",
      "position_m": [
        -1,
        0,
        0
      ],
      "mate_types": [
        "wall-line"
      ],
      "grid_locked": true,
      "note": "左侧窗框，接墙洞"
    },
    {
      "name": "end-east",
      "type": "wall-line",
      "direction": "+x",
      "position_m": [
        1,
        0,
        0
      ],
      "mate_types": [
        "wall-line"
      ],
      "grid_locked": true,
      "note": "右侧窗框，接墙洞"
    },
    {
      "name": "mount",
      "type": "attach",
      "direction": "-z",
      "position_m": [
        0,
        0.75,
        0
      ],
      "mate_types": [
        "attach",
        "wall-line",
        "stack-up",
        "roof-seat",
        "ridge-point",
        "continue"
      ],
      "note": "背贴墙面（attach 单向挂接）"
    }
  ],
  "license": "CC0-1.0",
  "author": "GBE-Studio · 程序化生成器（参数化，非 AI 生成）"
}
