{
  "schema_version": "2",
  "id": "cn-ancient.plant.grass-tuft-a",
  "name": "草丛（灰模）",
  "version": "1.0.0",
  "status": "published",
  "flags": [
    "needs-material-review"
  ],
  "kit": "cn-ancient",
  "category": "nature/plant",
  "tier": "primitive",
  "granularity": "L1",
  "tags": [
    "nature",
    "plant",
    "grass",
    "程序化",
    "灰模"
  ],
  "geometry": {
    "dimensions_m": [
      0.75,
      0.6507,
      0.75
    ],
    "pivot": "bottom-center",
    "axis": {
      "up": "+Y",
      "forward": "-Z"
    },
    "polycount": 96,
    "vertices": 288
  },
  "files": {
    "model": {
      "lod0": "lod0.glb"
    },
    "preview": [
      "preview.png"
    ],
    "collision": null
  },
  "shell": {
    "has_uv": false,
    "manifold": true,
    "solidified": true
  },
  "materials": {
    "slots": [
      {
        "slot": "trim",
        "ref": "earth/hang-tu"
      },
      {
        "slot": "ornament",
        "ref": "plant/cao-lv"
      }
    ],
    "embedded_textures": 0
  },
  "collision": "box",
  "sockets": [
    {
      "name": "bottom",
      "type": "ground-foot",
      "direction": "-y",
      "position_m": [
        0,
        0,
        0
      ],
      "mate_types": [
        "stack-up",
        "roof-seat"
      ],
      "grid_locked": true,
      "note": "落地"
    }
  ],
  "license": "CC0-1.0",
  "author": "GBE-Studio · 程序化生成器（参数化，非 AI 生成）"
}
